air france,4,"""return flight was changed so many times""", (New Caledonia) ,9th May 2022,,Couple Leisure,Economy Class,Paris to Amsterdam,May 2022,1,3,1,0,2,0,1,
air france,10,"""Plane was spotless""", (New Caledonia) ,5th May 2022,,Solo Leisure,Economy Class,Paris to Lyon,May 2022,5,5,5,0,5,0,5,yes
air france,1,"""got nothing but the run around""", (New Caledonia) ,19th April 2022,,Solo Leisure,Economy Class,,September 2021,0,0,0,0,0,0,1,
air france,2,"""would not recommend""", (New Caledonia) ,15th April 2022,,Family Leisure,Economy Class,Tel Aviv to Toronto via Paris,April 2022,3,1,2,3,1,4,1,
air france,1,"""didn’t bother to put my bag on the aircraft""", (New Caledonia) ,6th April 2022,A319,Business,Economy Class,Paris to Newcastle,April 2022,1,1,1,0,1,1,1,
air france,7,"""nothing by way of compensation""", (New Caledonia) ,5th April 2022,Boeing 777-200 / 777-300,Business,Business Class,Conakry to Washington via Paris,December 2021,4,4,4,4,2,4,3,yes
air france,1,"""fighting since 2.5 months to get money from the airline""", (New Caledonia) ,5th April 2022,,Business,Economy Class,Vienna to New York via Paris,January 2022,4,5,3,4,1,0,1,
air france,1,"""Zero responsibility""", (New Caledonia) ,4th April 2022,,Solo Leisure,Economy Class,Houston to Paris,January 2022,1,1,1,1,1,1,1,
air france,1,"""lack of respect""", (New Caledonia) ,3rd April 2022,,Business,Economy Class,Madrid to Cork via Paris,April 2022,1,1,1,1,1,1,1,
air france,1,"""didn’t confirm our seats on our Delta flights""", (New Caledonia) ,25th March 2022,,Couple Leisure,Economy Class,Detroit to Barcelona via Paris,March 2022,1,1,0,0,1,0,1,
air france,2,"""wouldn't have internet for the flight""", (United States) ,23rd October 2022,,Couple Leisure,Business Class,Paris to Chicago,October 2022,3,2,1,1,2,0,1,
air france,1,"""reimbursed us for 15% of the value""", (United States) ,22nd October 2022,,Couple Leisure,Economy Class,Paris to Los Angeles,September 2022,3,3,2,3,1,0,2,
air france,1,"""cancelled flight 15 minutes before departure""", (United States) ,21st October 2022,,Business,Economy Class,Bucharest to Paris,October 2022,0,0,0,0,1,0,1,
air france,1,"""hasn’t paid any compensation yet""", (United States) ,19th October 2022,,Family Leisure,Economy Class,Washington to Hamburg via Paris,July 2022,2,3,1,4,1,0,1,
air france,9,"""comfortable and the service friendly""", (United States) ,16th October 2022,Boeing 787,Business,Premium Economy,Bogota to Helsinki via Paris,October 2022,4,5,4,5,4,0,5,yes
air france,2,"""regret not having traveled by train""", (United States) ,12th October 2022,A321,Solo Leisure,Business Class,Paris to Montpellier,October 2022,3,2,1,0,1,1,1,
air france,10,"""The food and wine was extraordinary""", (United States) ,10th October 2022,Boeing 777-300,Solo Leisure,Business Class,Paris to Vancouver,September 2022,5,5,5,4,5,0,5,yes
air france,9,"""Would fly Air France again""", (United States) ,8th October 2022,Boeing 777-200,Couple Leisure,Economy Class,New U=York to Paris,October 2022,5,5,4,5,4,0,5,yes
air france,2,"""everything was so uncoordinated""", (United States) ,3rd October 2022,,Couple Leisure,Economy Class,New York to Stuttgart via Paris,October 2022,3,1,1,2,1,3,1,
air france,9,"""the best flight attendants""", (United States) ,30th September 2022,,Solo Leisure,Economy Class,Paris to Seattle,September 2022,4,5,5,5,3,5,5,yes
air france,7,"""I would fly Air France again""", (United States) ,4th December 2022,A350,Solo Leisure,Economy Class,Chicago to Paris,November 2022,4,4,3,4,3,3,4,yes
air france,9,"""outstanding, professional""", (United States) ,28th November 2022,A320 / Boeing 777-200,Solo Leisure,Business Class,Manchester to Bangkok via Paris ,November 2022,3,5,5,4,4,0,5,yes
air france,10,"""very professional, positive and engaging""", (United States) ,22nd November 2022,Boeing 777-200ER,Business,Economy Class,Paris to Miami,November 2022,4,5,4,5,4,5,5,yes
air france,8,"""Wonderful flight""", (United States) ,17th November 2022,Boeing 777,Solo Leisure,Business Class,Mexico City to Paris,November 2022,2,5,5,5,4,4,5,yes
air france,8,"""a classic legacy carrier""", (United States) ,14th November 2022,Boeing 777,Couple Leisure,Economy Class,Punta Cana to Paris CDG,November 2022,4,5,4,3,4,0,5,yes
air france,2,"""No compensation for their error""", (United States) ,8th November 2022,,Business,Business Class,Miami to Zanzibar via Paris,August 2022,3,2,1,1,2,1,1,
air france,9,"""Nice short trip on time""", (United States) ,5th November 2022,Embraer 190,Couple Leisure,Economy Class,Düsseldorf to Paris CDG,October 2022,4,5,4,0,5,0,5,yes
air france,1,"""nothing has been reimbursed so far""", (United States) ,31st October 2022,,Couple Leisure,Economy Class,Paris Orly to Pointe-à-Pitre,May 2022,2,1,2,3,1,1,1,
air france,6,"""need to feel welcomed and pampered""", (United States) ,31st October 2022,Boeing 777,Business,Business Class,Mauritius to Paris,October 2022,4,1,4,3,2,5,2,
air france,8,"""Food was disappointing""", (United States) ,25th October 2022,A350,Family Leisure,Premium Economy,Paris to Dubai,October 2022,5,5,1,0,4,5,5,yes
air france,10,"""impressed by the Air France flight crew""", (United States) ,26th August 2022,,Family Leisure,Economy Class,New York to Bangalore via Paris,August 2022,5,5,0,0,5,0,5,yes
air france,1,"""The refund was never made""", (United States) ,25th August 2022,,Business,Economy Class,Trondheim to London via Amsterdam,April 2022,0,0,0,0,1,0,1,
air france,10,"""such a wonderful experience""", (United States) ,19th August 2022,Boeing 787,Family Leisure,Economy Class,London to Punta Cana via Paris,August 2022,5,5,5,5,5,5,5,yes
air france,10,"""Outstanding service""", (United States) ,19th August 2022,Boeing 777-300,Business,Business Class,Bucharest to New York via Paris,August 2022,5,5,5,3,5,5,5,yes
air france,1,"""weigh their carry-on luggage""", (United States) ,13th August 2022,,Couple Leisure,Economy Class,Paris to Prague,August 2022,3,1,0,0,1,0,1,
air france,1,"""missing one checked bag""", (United States) ,11th August 2022,,Solo Leisure,Economy Class,Orlando to Beirut via Manchester / Paris,July 2022,2,1,1,3,2,3,1,
air france,6,"""The in flight experience was fine""", (United States) ,9th August 2022,Boeing 777,Family Leisure,Economy Class,New York to Paris CDG,July 2022,3,3,3,4,2,0,4,yes
air france,6,"""never encountered such incompetence""", (United States) ,4th August 2022,Boeing 777-200 / 777-300,Business,Business Class,Washington to Conakry via Paris,December 2021,4,4,5,4,1,4,2,
air france,1,"""5 hours waiting to get our 2 carry-on bags""", (United States) ,4th August 2022,,Family Leisure,Economy Class,Paris to Miami,August 2022,1,0,0,0,1,0,1,
air france,9,"""excellent on-board service""", (United States) ,3rd August 2022,Boeing 773 / A319,Couple Leisure,Business Class,Montreal to Marseille via Paris,July 2022,5,5,4,4,3,4,5,yes
air france,1,"""there is nobody who can help you"" ", (Canada) ,2nd August 2022,A330-300,Couple Leisure,Economy Class,Vancouver to Paris ,August 2022,0,0,0,0,0,0,1,
air france,1,"""It's been a fight to get my refund""", (Canada) ,2nd August 2022,,Business,Business Class,Rome to Lisbon Via Paris,June 2022,0,0,0,0,3,0,1,
air france,1,"""All in all very disappointing""", (Canada) ,1st August 2022,,Business,Business Class,Paris to Düsseldorf,June 2022,3,1,4,0,2,0,2,
air france,1,"""still haven’t gotten the money back""", (Canada) ,26th July 2022,,Solo Leisure,Economy Class,New York to Paris,June 2022,1,1,0,0,1,0,1,
air france,1,"""they are losing luggage""", (Canada) ,26th July 2022,,Solo Leisure,Economy Class,Zurich to Punta Cana via Paris,July 2022,1,1,3,5,1,3,1,
air france,1,"""lost our luggage and cannot locate it""", (Canada) ,26th July 2022,,Family Leisure,Economy Class,Paris to New York ,July 2022,1,1,1,1,1,1,1,
air france,1,"""We were not the only people who spent the night at the airport""", (Canada) ,24th July 2022,,Couple Leisure,Economy Class,"Washington, DC to Athens via Paris",June 2022,1,1,1,2,1,0,2,
air france,10,"""a wonderful experience with Air France""", (Canada) ,24th July 2022,A350-900,Solo Leisure,Economy Class,Paris CDG to Toronto,July 2022,4,5,5,5,5,5,5,yes
air france,9,"""A350 Business class were exceptional""", (Canada) ,22nd July 2022,A320/A350,Couple Leisure,Business Class,Marseille to Montreal via paris,July 2022,4,5,5,4,3,3,5,yes
air france,1,"""Complained 9 weeks ago""", (Canada) ,21st July 2022,Boeing 777-300,Solo Leisure,Economy Class,Seoul to Manchester via Paris,May 2022,1,1,1,1,1,1,1,
air france,9,"""Kudos to the attentiveness of the Air France agents!""", (Canada) ,23rd June 2022,,Couple Leisure,Premium Economy,Paris to Vancouver via Victoria ,June 2022,4,4,4,4,5,0,4,yes
air france,7,"""would recommend flying with them""", (Canada) ,21st June 2022,,Family Leisure,Economy Class,Osaka to Rome via Paris,May 2022,1,4,3,4,4,3,3,yes
air france,10,"""rest of the crew were equally supportive""", (Canada) ,21st June 2022,A350,Couple Leisure,Economy Class,Paris to Montreal,June 2022,4,5,4,4,4,4,4,yes
air france,1,"""Horrible service and food""", (Canada) ,20th June 2022,,Couple Leisure,Economy Class,Paris to Vancouver,June 2022,2,1,1,3,2,1,1,
air france,10,"""He really made our day""", (Canada) ,19th June 2022,,Family Leisure,Economy Class,Mumbai to Paris,June 2022,5,5,5,5,5,5,5,yes
air france,9,"""A smooth and hassle-free flight""", (Canada) ,18th June 2022,A220-300,Solo Leisure,Economy Class,Paris CDG to Berlin,April 2022,5,5,5,2,5,5,5,yes
air france,10,"""Was pleasantly surprised with Air France""", (Canada) ,15th June 2022,A330,Couple Leisure,Economy Class,Paris to Sint Maarten,June 2022,3,5,5,5,5,0,5,yes
air france,2,"""will avoid Air France at all costs""", (Canada) ,14th June 2022,,Family Leisure,Economy Class,Washington  to Florence via Paris CDG,June 2022,1,5,1,3,1,1,1,
air france,1,"""they lost my suitcase""", (Canada) ,12th June 2022,,Solo Leisure,Economy Class,Johannesburg to Paris via Heathrow,June 2022,1,1,1,2,1,0,2,
air france,1,"""rebooking experience was so disappointing""", (Canada) ,9th June 2022,,Solo Leisure,Economy Class,Berlin to Seoul via Amsterdam,April 2022,2,1,3,2,2,0,2,
air france,7,"""this was a pleasant experience""", (Australia) ,18th July 2022,A320/A321,Couple Leisure,Economy Class,London to Lisbon via Paris,June 2022,4,4,5,0,3,0,5,yes
air france,3,"""worst baggage service I ever seen""", (Australia) ,18th July 2022,,Family Leisure,Economy Class,Dallas to Chennai via Paris,June 2022,2,1,1,0,2,0,2,
air france,1,"""The flight attendants were nice""", (Australia) ,17th July 2022,,Solo Leisure,Economy Class,Istanbul to New York via Paris CDG,July 2022,1,2,1,1,1,0,1,
air france,9,"""best international flight I’ve ever been on""", (Australia) ,17th July 2022,Boeing 777-300ER,Family Leisure,Business Class,Senegal to Paris,July 2022,5,5,5,4,4,5,4,yes
air france,1,"""Do not use Air France if you have another option!""", (Australia) ,16th July 2022,,Family Leisure,Economy Class,Naples to Paris CDG via New York JFK,July 2022,3,5,5,5,1,0,1,
air france,1,"""This has been a bad experience""", (Australia) ,15th July 2022,,Couple Leisure,Economy Class,Lyon to Venice via Paris,July 2022,2,3,0,0,1,0,1,
air france,2,"""I still don't have my luggage""", (Australia) ,14th July 2022,,Business,Economy Class,Lisbon to Osaka via Paris,July 2022,1,1,1,0,1,0,1,
air france,1,"""no information or sign of luggage""", (Australia) ,13th July 2022,,Business,Economy Class,Berlin to Cancun via Paris,July 2022,2,1,1,0,3,0,1,
air france,1,"""will never fly with Air France again""", (Australia) ,13th July 2022,Boeing 777,Solo Leisure,Business Class,Bangkok to Newcastle via Paris,July 2022,3,1,1,1,2,0,1,
air france,1,"""still not received my bag.""", (Australia) ,12th July 2022,,Couple Leisure,Economy Class,Paris to Birmingham ,June 2022,1,1,0,0,1,0,1,
air france,8,"""a good experience""", (France) ,21st March 2022,,Solo Leisure,Economy Class,Bucharest to Paris,March 2022,4,5,4,0,5,0,4,yes
air france,1,"""Extremely poor customer service""", (France) ,15th March 2022,,Solo Leisure,Economy Class,Toronto to Dubai via Paris,March 2022,0,0,0,0,1,0,1,
air france,2,"""I got no compensation""", (France) ,14th March 2022,Boeing 777,Solo Leisure,Economy Class,Paris to Chicago,November 2021,3,5,0,0,4,0,2,
air france,1,"""6 days now and no answer""", (France) ,11th March 2022,,Solo Leisure,Economy Class,Tunis to Boston via Paris,March 2022,2,3,0,0,1,0,1,
air france,2,"""service in Mumbai is sub-par at best""", (France) ,27th February 2022,A350,Solo Leisure,Economy Class,Mumbai to Paris,February 2022,4,1,1,0,1,0,1,
air france,8,"""Very relaxed flight""", (France) ,20th February 2022,Boeing 777-300ER / A320,Solo Leisure,Economy Class,Bangkok to London via Paris,February 2022,4,5,4,3,4,4,5,yes
air france,10,"""flying like in the good old days""", (France) ,18th February 2022,Boeing 777 / A319,Solo Leisure,Economy Class,Budapest to New York visa Paris,February 2022,5,5,5,5,5,5,5,yes
air france,7,"""my trip was pretty good.""", (France) ,9th February 2022,,Solo Leisure,Economy Class,Washington to Rabat via Paris,November 2021,3,3,3,4,4,3,3,yes
air france,1,"""my baggage didn't make it""", (France) ,27th January 2022,,Solo Leisure,Economy Class,Nice to Beirut via  Paris ,January 2022,3,4,4,4,1,0,3,
air france,3,Air France customer review, (France) ,26th January 2022,Boeing 787,Couple Leisure,Economy Class,"Colombo, Sri Lanka to Paris, France",January 2022,3,1,2,5,4,4,2,
air france,1,"""Awful customer service""", (United Kingdom) ,5th June 2022,,Couple Leisure,Economy Class,Bangkok to London Heathrow via Paris,May 2022,2,1,0,3,1,2,1,
air france,1,"""extremely disappointed""", (United Kingdom) ,5th June 2022,,Solo Leisure,Economy Class,Paris to Toronto,June 2022,1,3,2,3,1,0,3,
air france,1,"""week in Argentina without my luggage""", (United Kingdom) ,3rd June 2022,,Business,Business Class,Geneva to Buenos Aires via Paris ,May 2022,2,1,0,0,1,0,1,
air france,8,"""I really liked the whole experience""", (United Kingdom) ,2nd June 2022,Boeing 777-300ER,Solo Leisure,Business Class,San Francisco to Paris,May 2022,4,5,4,4,3,0,5,yes
air france,3,"""their system would not let me enter/select special meals""", (United Kingdom) ,31st May 2022,,Solo Leisure,Economy Class,"Paris, France to Bangalore, India",May 2022,2,3,1,2,4,3,2,
air france,7,"""Shameful and inexcusable""", (United Kingdom) ,22nd May 2022,Boeing 777-200 / 777-300,Business,Business Class,Conakry to Washington via Paris,December 2021,4,4,0,0,1,0,3,
air france,1,"""Very disrespectful""", (United Kingdom) ,22nd May 2022,,Family Leisure,Business Class,Abuja to Amsterdam via Paris,May 2022,4,3,3,2,1,4,1,
air france,3,"""Very poor meals for a 10hour flight""", (United Kingdom) ,22nd May 2022,,Couple Leisure,Economy Class,Paris to Havana,May 2022,1,2,1,1,4,3,2,
air france,2,"""nothing but polite, courteous""", (United Kingdom) ,18th May 2022,Boeing 777,Solo Leisure,Economy Class,Toronto to Mumbai via Paris,April 2022,2,1,3,3,1,4,2,
air france,1,"""It was inhumane""", (United Kingdom) ,15th May 2022,,Couple Leisure,Economy Class,Paris CDG to Los Angeles,May 2022,2,1,1,2,3,0,1,
air france,8,"""great alternative to fly across the Atlantic""", (United Kingdom) ,19th January 2022,Boeing 777-300ER,Solo Leisure,Premium Economy,Paris to Miami,November 2021,3,4,3,5,5,5,4,yes
air france,8,"""A pleasurable experience!""", (United Kingdom) ,4th January 2022,A320/350-900,Solo Leisure,Economy Class,Bordeaux to Atlanta via Paris,December 2021,3,5,4,4,4,5,3,yes
air france,1,"""poorly organised and poorly communicated""", (United Kingdom) ,30th December 2021,Boeing 777-300,Solo Leisure,Economy Class,Chicago to Newcastle via Paris,December 2021,0,0,0,0,1,0,1,
air france,9,"""Air France was very professional""", (United Kingdom) ,19th December 2021,,Solo Leisure,Economy Class,Rome to Singapore,December 2021,5,5,4,4,5,4,5,yes
air france,1,"""I did receive a full refund""", (United Kingdom) ,16th December 2021,,Solo Leisure,Economy Class,Boston to Rome via Paris,August 2021,0,0,0,0,0,0,1,
air france,8,"""Air France was very pleasant""", (United Kingdom) ,14th December 2021,A350-900,Solo Leisure,Economy Class,Frankfurt to Toronto via Paris,October 2021,5,4,4,4,4,5,4,yes
air france,8,"""Air France was very pleasant""", (United Kingdom) ,14th December 2021,A350-900,Solo Leisure,Economy Class,Frankfurt to Toronto via Paris,October 2021,5,4,4,4,4,5,4,yes
air france,10,"""delivered great service as expected""", (United Kingdom) ,13th December 2021,A220-300,Solo Leisure,Economy Class,Paris to Madrid,November 2021,5,5,3,0,5,0,5,yes
air france,10,"""Service onboard was fantastic""", (United Kingdom) ,11th December 2021,Boeing 777-300ER,Solo Leisure,Economy Class,New York to Paris,November 2021,5,5,5,5,5,0,5,yes
air france,1,"""waited for over 45mins on the line""", (United Kingdom) ,9th December 2021,,Solo Leisure,Economy Class,London to Marrakech via Paris,December 2021,0,0,0,0,0,0,1,
air france,7,"""business class tagged bag was last to arrive""", (United States) ,4th October 2021,A318,Solo Leisure,Business Class,Paris to Milan,October 2021,2,5,1,0,5,4,3,yes
air france,9,"""Efficient friendly service""", (United States) ,4th October 2021,Boeing 787-9,Solo Leisure,Business Class,Boston to Paris,October 2021,5,5,5,5,4,5,5,yes
air france,1,"""we will never again fly AF""", (United States) ,3rd October 2021,Boeing 777-300,Couple Leisure,Business Class,Paris to Los Angeles,September 2021,3,1,1,4,1,0,1,
air france,1,"""provided a 10 minute window for boarding""", (United States) ,3rd October 2021,,Business,Premium Economy,Vienna to Paris CDG,August 2021,1,1,0,0,1,0,1,
air france,10,"""I really recommend Air France""", (United States) ,3rd October 2021,,Solo Leisure,Economy Class,Washington to Paris CDG,September 2021,5,5,5,5,5,5,5,yes
air france,1,"""zero service in Business Class""", (United States) ,9th September 2021,E190,Business,Economy Class,Manchester to Paris CDG,August 2021,2,1,1,0,3,0,1,
air france,9,"""really down to a fabulous crew""", (United States) ,8th September 2021,Boeing 787,Couple Leisure,Business Class,Lisbon to Paris CDG via Detroit ,August 2021,4,5,5,5,1,1,5,yes
air france,7,"""Service on board was efficient""", (United States) ,24th August 2021,CRJ1000,Couple Leisure,Economy Class,Amsterdam to Marseille,August 2021,2,4,2,0,5,0,3,yes
air france,2,"""no longer giving miles  with Economy class""", (United States) ,18th August 2021,A319,Solo Leisure,Economy Class,Paris CDG to Warsaw,August 2021,2,4,0,0,1,0,1,
air france,1,"""Easyjet's a way better option for intra European travel""", (United States) ,12th August 2021,A320,Business,Economy Class,Paris to Venice,August 2021,1,1,0,0,1,0,1,
air france,1,"""When I ask they say go to WestJet""", (Canada) ,9th July 2022,,Family Leisure,Economy Class,Nairobi to Toronto via Paris,July 2022,1,1,1,0,1,0,1,
air france,1,"""promised to deliver the missing baggage""", (Canada) ,5th July 2022,,Solo Leisure,Economy Class,London to Paris,June 2022,1,2,0,1,1,0,1,
air france,5,"""Some of the cabin crew were gloomy""", (Canada) ,4th July 2022,,Solo Leisure,Economy Class,Paris to Berlin,July 2022,3,2,3,0,1,0,3,
air france,1,"""flight is postponed to the next day""", (Canada) ,1st July 2022,,Couple Leisure,Premium Economy,Paris to Delhi,June 2022,1,1,0,0,1,0,1,
air france,1,"""tickets are very expensive""", (Canada) ,29th June 2022,,Business,Economy Class,Birmingham to Paris,June 2022,1,3,1,1,2,0,1,
air france,9,"""providing exceptional customer service""", (Canada) ,27th June 2022,,Couple Leisure,Premium Economy,Firenze to Paris,June 2022,5,5,5,5,5,3,5,yes
air france,3,"""this is my first and last trip with AF""", (Canada) ,27th June 2022,,Solo Leisure,Economy Class,Montreal to Paris via Tunis,June 2022,4,4,4,4,1,1,2,
air france,1,"""caused us so much unnecessary stress""", (Canada) ,26th June 2022,,Couple Leisure,Economy Class,Paris to Nice,June 2022,1,5,2,1,1,0,1,
air france,1,"""airline lost the luggage""", (Canada) ,26th June 2022,,Couple Leisure,Economy Class,New York to Bordeaux via Paris,June 2022,1,3,1,1,1,1,1,
air france,5,"""food was not up to the quality""", (Canada) ,25th June 2022,,Business,Business Class,Mumbai to Los Angeles via Paris,June 2022,3,1,2,2,4,2,3,
air france,7,"""I would fly Air France again""", (United States) ,4th December 2022,A350,Solo Leisure,Economy Class,Chicago to Paris,November 2022,4,4,3,4,3,3,4,yes
air france,9,"""outstanding, professional""", (United States) ,28th November 2022,A320 / Boeing 777-200,Solo Leisure,Business Class,Manchester to Bangkok via Paris ,November 2022,3,5,5,4,4,0,5,yes
air france,10,"""very professional, positive and engaging""", (United States) ,22nd November 2022,Boeing 777-200ER,Business,Economy Class,Paris to Miami,November 2022,4,5,4,5,4,5,5,yes
air france,8,"""Wonderful flight""", (United States) ,17th November 2022,Boeing 777,Solo Leisure,Business Class,Mexico City to Paris,November 2022,2,5,5,5,4,4,5,yes
air france,8,"""a classic legacy carrier""", (United States) ,14th November 2022,Boeing 777,Couple Leisure,Economy Class,Punta Cana to Paris CDG,November 2022,4,5,4,3,4,0,5,yes
air france,2,"""No compensation for their error""", (United States) ,8th November 2022,,Business,Business Class,Miami to Zanzibar via Paris,August 2022,3,2,1,1,2,1,1,
air france,9,"""Nice short trip on time""", (United States) ,5th November 2022,Embraer 190,Couple Leisure,Economy Class,Düsseldorf to Paris CDG,October 2022,4,5,4,0,5,0,5,yes
air france,1,"""nothing has been reimbursed so far""", (United States) ,31st October 2022,,Couple Leisure,Economy Class,Paris Orly to Pointe-à-Pitre,May 2022,2,1,2,3,1,1,1,
air france,6,"""need to feel welcomed and pampered""", (United States) ,31st October 2022,Boeing 777,Business,Business Class,Mauritius to Paris,October 2022,4,1,4,3,2,5,2,
air france,8,"""Food was disappointing""", (United States) ,25th October 2022,A350,Family Leisure,Premium Economy,Paris to Dubai,October 2022,5,5,1,0,4,5,5,yes
air france,1,"""call centre obviously doesn't care""", (United Kingdom) ,30th September 2022,,Business,Economy Class,London to Dubai via Paris,September 2022,2,2,0,0,1,0,1,
air france,1,"""took them over 2 months to refund""", (United Kingdom) ,27th September 2022,Boeing 777,Solo Leisure,Economy Class,Hamburg to Punta Cana via Paris CDG,July 2022,3,2,2,0,1,0,1,
air france,10,"""has been improving recently""", (United Kingdom) ,26th September 2022,A350,Family Leisure,Economy Class,Atlanta to Paris,June 2022,5,5,5,5,5,5,5,yes
air france,1,"""the staff were incredibly rude""", (United Kingdom) ,23rd September 2022,,Solo Leisure,Economy Class,Birmingham to Paris via Budapest,April 2022,1,1,0,0,1,0,1,
air france,1,"""still fight them for the proper compensation""", (United Kingdom) ,20th September 2022,,Couple Leisure,Economy Class,Milan to New York via Paris CDG,January 2022,1,1,1,1,1,1,1,
air france,9,"""a pleasant flight""", (United Kingdom) ,8th September 2022,A350/E190,Family Leisure,Economy Class,Singapore to Nuremberg via Paris,September 2022,4,5,4,5,5,2,5,yes
air france,7,"""Thank you Air France!""", (United Kingdom) ,8th September 2022,,Couple Leisure,Economy Class,Manchester to Paris via Bangaluru,September 2022,4,3,3,4,3,4,5,yes
air france,2,"""it took Air France 3 days to ship my bag to me""", (United Kingdom) ,7th September 2022,,Business,Economy Class,Conakry to London Heathrow via Paris,September 2022,3,3,1,1,1,0,1,
air france,9,"""this airline is really improving""", (United Kingdom) ,5th September 2022,Boeing 777-300,Solo Leisure,First Class,Montréal to Paris,September 2022,4,5,5,5,4,5,4,yes
air france,1,"""frustrated by the utter lack of professionalism""", (United Kingdom) ,30th August 2022,Embraer 170,Solo Leisure,Economy Class,Paris to Zurich,August 2022,2,5,2,0,1,0,1,
air france,7,"""I can't say I'd be rushing to book with them again""", (United States) ,6th December 2021,Boeing 777-200 and Boeing 777-300,Business,Business Class,Conakry to Washington via Paris,December 2021,3,4,4,4,2,3,3,yes
air france,5,"""All in all, a decent experience""", (United States) ,5th December 2021,Boeing 777-200 / A320-200,Solo Leisure,Business Class,Mosco to London via Paris,December 2021,3,4,3,4,3,5,4,
air france,1,"""My experience was very horrible""", (United States) ,1st December 2021,,Solo Leisure,Economy Class,London Heathrow to San Francisco via Italy & Paris,November 2021,1,1,1,1,1,1,1,
air france,6,"""Check-in was a mess""", (United States) ,29th November 2021,Boeing 777-300,Business,Business Class,Washington to Paris,November 2021,3,3,1,2,1,0,3,
air france,1,"""WIFI not working""", (United States) ,23rd November 2021,,Business,Premium Economy,Milan to Los Angeles via Paris,November 2021,1,1,3,3,1,1,1,
air france,1,"""told me the flight had already left""", (United States) ,16th November 2021,,Solo Leisure,Economy Class,Tunis to Geneva via Paris,November 2021,3,1,1,0,1,4,1,
air france,1,"""was refused access to the plane""", (United States) ,12th November 2021,,Solo Leisure,Economy Class,Paris to Miami via Madrid,October 2021,3,3,2,2,1,1,3,
air france,3,"""do not overpay for business class""", (United States) ,26th October 2021,Boeing 777-200,Business,Business Class,San José to Paris,October 2021,2,2,2,2,2,0,2,
air france,3,""" cannot be considered as carry on""", (United States) ,14th October 2021,,Business,Economy Class,Barcelona to Paris,October 2021,2,4,1,0,1,0,3,
air france,1,"""I still have to see my money back""", (United States) ,6th October 2021,,Business,Economy Class,Fortaleza to Warsaw via Paris,April 2021,0,0,0,0,0,0,3,
air france,1,"""forgot a part of the luggage in Paris""", (Belgium) ,30th July 2021,,Family Leisure,Economy Class,Paris to Yaounde,July 2021,3,4,3,4,1,0,1,
air france,1,"""the worst travel experience""", (Belgium) ,25th June 2021,,Family Leisure,Economy Class,Washington to Douala via Paris,June 2021,1,1,1,0,1,0,1,
