air france,4,"""it was completely under par""", (South Africa) ,21st December 2017,A380,Couple Leisure,Business Class,Paris to Cape Town via Johannesburg,December 2017,1,4,2,2,1,0,1,
air france,10,"""the best First available""", (South Africa) ,21st December 2017,Boeing 777-300,Solo Leisure,First Class,Paris to Beijing,December 2017,5,5,5,5,5,0,5,yes
air france,6,"""the flight was average""", (South Africa) ,20th December 2017,A380,Couple Leisure,Economy Class,Johannesburg to Munich via Paris,December 2017,3,3,3,1,3,0,3,yes
air france,10,"""aircraft was clean and comfortable""", (South Africa) ,19th December 2017,A319,Business,Economy Class,London to Paris CDG,October 2017,4,4,4,0,4,0,5,yes
air france,10,"""very good value for money""", (South Africa) ,18th December 2017,A320,Solo Leisure,Economy Class,Lisbon to Paris CDG,December 2017,5,5,5,5,5,5,5,yes
air france,3,"""difference to low cost airlines minimal""", (South Africa) ,17th December 2017,,Solo Leisure,Economy Class,Tel Avivi to Stockholm via Paris CDG,November 2017,2,2,2,0,4,0,3,
air france,5,"""I would fly them again""", (South Africa) ,16th December 2017,,Business,Economy Class,Cape Town to Los Angeles via Paris CDG,December 2017,2,3,3,2,4,0,3,yes
air france,2,"""service on board was just average""", (South Africa) ,14th December 2017,,Solo Leisure,Economy Class,Sydney to Paris CDG via Shanghai,August 2017,3,2,4,3,2,0,1,
air france,10,"""Enjoyed flying with Air France""", (South Africa) ,14th December 2017,Boeing 777-200ER,Solo Leisure,Economy Class,Paris to Vancouver,October 2017,5,5,5,5,4,0,5,yes
air france,2,"""AF spreading this busline of theirs""", (South Africa) ,14th December 2017,A320,Business,Economy Class,Barcelona to Paris CDG,December 2017,3,3,1,1,4,1,1,
air france,10,"""attendants smiling and friendly""", (United Kingdom) ,25th January 2018,Boeing 777-200,Solo Leisure,Economy Class,London to Vancouver via Paris,December 2017,4,4,5,5,4,0,5,yes
air france,10,"""What a great flight""", (United Kingdom) ,23rd January 2018,A319,Couple Leisure,Business Class,Naples to Paris CDG,January 2018,4,5,5,0,5,0,5,yes
air france,10,"""still possible to enjoy flying""", (United Kingdom) ,23rd January 2018,A319 / A320,Family Leisure,Economy Class,Heathrow to Paris CDG,January 2018,4,5,4,0,5,0,5,yes
air france,9,"""my daughters child meal was exceptional""", (United Kingdom) ,10th January 2018,Boeing 777-200,Family Leisure,Economy Class,Buenos Aires to Paris ,December 2017,4,5,5,4,4,0,5,yes
air france,9,"""Overall, a good flight""", (United Kingdom) ,7th January 2018,A320,Couple Leisure,Economy Class,Berlin TXL to Paris CDG,January 2018,5,5,3,4,4,4,3,yes
air france,3,"""expect your luggage to arrive""", (United Kingdom) ,31st December 2017,Boeing 777-200,Couple Leisure,Business Class,Paris to Sao Paulo,December 2017,4,4,5,4,1,1,1,
air france,9,"""seat was comfortable""", (United Kingdom) ,28th December 2017,Boeing 787,Solo Leisure,Economy Class,London to Paris,November 2017,5,4,5,5,4,0,5,yes
air france,10,"""clean, beautiful cabin""", (United Kingdom) ,27th December 2017,Boeing 777-200,Solo Leisure,Economy Class,Paris to Vancouver,October 2017,4,4,4,5,5,0,5,yes
air france,10,"""still very good comfort""", (United Kingdom) ,27th December 2017,Boeing 777-300,Solo Leisure,Business Class,Paris to Rio de Janeiro,December 2017,5,5,5,5,5,0,5,yes
air france,3,"""Sub par experience""", (United Kingdom) ,26th December 2017,,Family Leisure,Economy Class,Paris CDG to Berlin,December 2017,3,3,0,0,1,0,1,
air france,9,"""rate them highly""", (United Kingdom) ,20th February 2018,Boeing 777-300ER,Family Leisure,Business Class,Dubai to Southampton via Paris CDG,February 2018,3,5,4,4,5,0,5,yes
air france,3,"""avoid Air France in the future""", (United Kingdom) ,16th February 2018,,Solo Leisure,Economy Class,Moscow to London via Paris,February 2018,2,3,4,0,1,0,4,
air france,1,"""Air France will not be an option to consider""
", (United Kingdom) ,15th February 2018,,Family Leisure,Economy Class,Paris to New York,February 2018,1,1,3,3,1,1,1,
air france,10,"""whole experience was excellent""", (United Kingdom) ,11th February 2018,Boeing 777-300,Family Leisure,Business Class,Southampton to Dubai via Paris CDG,May 2017,5,5,5,5,5,5,5,yes
air france,1,"""Absolutely terrible service""", (United Kingdom) ,9th February 2018,,Business,Business Class,Lisbon to Washington via Paris,February 2018,1,1,1,1,1,1,1,
air france,9,"""flight itself was spectacular""", (United Kingdom) ,7th February 2018,A320,Family Leisure,Economy Class,Athens to Paris,October 2017,5,5,4,4,5,0,4,yes
air france,4,"""customer is treated like a cow""", (United Kingdom) ,7th February 2018,A320,Business,Economy Class,Orly to Toulon,February 2018,3,1,0,0,1,0,2,
air france,9,"""breakfast served was very good""", (United Kingdom) ,3rd February 2018,,Solo Leisure,Business Class,Reunion to Paris,January 2018,3,5,5,4,5,0,3,yes
air france,8,"""promptly brought our nice dishes""", (United Kingdom) ,3rd February 2018,,Solo Leisure,Business Class,Paris to Reunion,January 2018,3,4,5,3,5,0,4,yes
air france,8,"""attendants cheerful and smiling""", (United Kingdom) ,2nd February 2018,Boeing 777,Couple Leisure,Business Class,Paris to Singapore,January 2018,3,5,5,4,4,0,4,yes
air france,8,"""service was extraordinary""", (United States) ,18th February 2017,A380-800,Solo Leisure,Business Class,Paris CDG to New York,April 2016,5,5,5,5,4,0,5,yes
air france,9,"""Perfect just about sums it up""", (United States) ,18th February 2017,Boeing 777-200ER,Solo Leisure,Business Class,New York to Paris,May 2016,5,5,5,5,3,0,5,yes
air france,9,"""glad that AF proved me wrong""", (United States) ,13th February 2017,Boeing 777,Solo Leisure,Economy Class,Birmingham to Singapore via Paris,January 2017,4,5,4,5,3,4,5,yes
air france,2,"""ignored my request for a refund """, (United States) ,11th February 2017,,Family Leisure,Economy Class,Stuttgart to Toronto via Paris,October 2016,2,3,3,3,2,0,1,
air france,10,"""still give hot drinks, water and a snack""", (United States) ,8th February 2017,Boeing 787,Solo Leisure,Economy Class,London Heathrow to Paris CDG,February 2017,5,5,5,0,5,0,5,yes
air france,8,"""friendly, professional crew""", (United States) ,3rd February 2017,Boeing 777-300 /  Avro RJ85,Solo Leisure,Economy Class,GIG to DUB via CDG,December 2016,4,4,3,4,5,0,3,yes
air france,9,"""staff onboard were very friendly""", (United States) ,2nd February 2017,,Business,Business Class,Paris CDG to Madrid,February 2017,4,5,4,0,5,0,4,yes
air france,7,"""crew are efficient and attentive""", (United States) ,27th January 2017,Boeing 777-200 / E195,Solo Leisure,Business Class,Seoul to Birmingham via Paris,January 2017,5,4,4,3,2,0,4,yes
air france,1,"""never apologized, it's a shame""", (United States) ,25th January 2017,,Couple Leisure,Economy Class,Marseille to Paris,January 2017,3,1,0,0,1,0,1,
air france,6,"""a decent experience""", (United States) ,18th January 2017,A340,Solo Leisure,Economy Class,Paris to Bogota,January 2017,2,4,5,4,4,3,3,yes
air france,8,"""a good flying experience""", (United Kingdom) ,12th December 2017,A319/A320,Solo Leisure,Economy Class,Hamburg to Paris CDG,March 2017,3,4,4,0,5,0,4,yes
air france,1,"""horrible start to the holiday""", (United Kingdom) ,9th December 2017,,Family Leisure,Economy Class,London Heathrow to Mauritius via Paris,December 2017,3,3,2,3,2,3,3,
air france,1,"""it was Air France at fault""", (United Kingdom) ,3rd December 2017,,Solo Leisure,Economy Class,Paris to Abu Dhabi,November 2017,0,0,0,0,1,0,1,
air france,2,"""not sure I will travel Air France again""", (United Kingdom) ,3rd December 2017,,Family Leisure,Economy Class,Nice to Paris,December 2017,1,5,0,0,1,0,1,
air france,1,"""such a poor experience""", (United Kingdom) ,2nd December 2017,,Solo Leisure,Economy Class,Bogota to Rome via Paris,November 2017,3,1,3,1,1,0,1,
air france,2,"""Ridiculous and insulting""", (United Kingdom) ,1st December 2017,,Couple Leisure,Economy Class,Vienna to London Heathrow via Paris CDG,December 2016,4,3,3,0,1,0,2,
air france,1,"""experience very poor and stressful""", (United Kingdom) ,25th November 2017,,Family Leisure,Economy Class,Barcelona to Atlanta via Paris,October 2017,1,1,0,0,1,0,1,
air france,7,"""cabin staff were much better""", (United Kingdom) ,24th November 2017,Boeing 787-9,Family Leisure,Economy Class,London to Paris,June 2017,4,5,4,5,1,0,4,yes
air france,1,"""we were involuntarily downgraded""", (United Kingdom) ,24th November 2017,A340,Couple Leisure,Economy Class,Papeete to Los Angeles,November 2017,1,2,1,1,1,1,1,
air france,1,"""what a shame""", (United Kingdom) ,20th November 2017,,Solo Leisure,Business Class,Madrid to Jakarta via Paris,November 2017,3,4,4,2,1,1,4,
air france,1,"""don't care about your baggage""", (Bulgaria) ,18th November 2017,,Couple Leisure,Economy Class,Paris to Sofia,October 2017,1,1,1,0,1,0,1,
air france,1,"""no one would even help us""", (Bulgaria) ,17th November 2017,,Business,Economy Class,Barcelona to Paris,November 2017,1,1,0,0,1,0,1,
air france,10,"""Economy seat was comfortable""", (Bulgaria) ,15th November 2017,Boeing 777-200ER,Solo Leisure,Economy Class,Paris to Vancouver,October 2017,5,5,5,5,5,0,5,yes
air france,9,"""one of European best airline""", (Bulgaria) ,14th November 2017,Boeing 777-300ER,Couple Leisure,Economy Class,Hamburg to Bangkok via Paris CDG,March 2017,3,4,5,4,5,0,5,yes
air france,10,"""cabin crews were helpful and friendly""", (Bulgaria) ,14th November 2017,A320,Business,Economy Class,London to Paris,October 2017,4,5,5,0,5,0,5,yes
air france,1,"""Staff offered no help""", (Bulgaria) ,10th November 2017,,Solo Leisure,Economy Class,Madrid to Paris,November 2017,1,3,0,0,1,0,1,
air france,6,"""I was expecting more""", (Bulgaria) ,9th November 2017,A380,Business,Business Class,Paris to Johannesburg,November 2017,1,3,3,5,3,2,3,
air france,1,"""downgraded with no advance warning""", (Bulgaria) ,6th November 2017,,Business,Premium Economy,Shanghai to Paris,November 2017,1,2,3,3,2,0,1,
air france,8,"""a wonderful Air France employee""", (Bulgaria) ,5th November 2017,A380,Family Leisure,Economy Class,San Francisco to Paris,October 2017,3,4,3,4,5,4,5,yes
air france,1,"""they were not responsible for the delay""", (Bulgaria) ,4th November 2017,,Solo Leisure,Economy Class,Frankfurt to Montpellier via Paris,September 2017,3,3,0,0,1,0,1,
air france,1,"""worst flight experience ever""", (Netherlands) ,28th September 2017,Boeing 787-9,Couple Leisure,Premium Economy,Amsterdam to Cairo via Paris,September 2017,3,5,0,0,1,0,1,
air france,2,"""the worst airline food""", (Netherlands) ,24th September 2017,Boeing 777-300ER,Couple Leisure,Premium Economy,Atlanta to Paris,September 2017,2,2,1,3,3,0,2,
air france,6,"""low cost flight at rather expensive price""", (Netherlands) ,21st September 2017,ERJ-190,Solo Leisure,Economy Class,Ljubliana to Paris,August 2017,2,4,3,0,4,0,3,yes
air france,10,"""enjoyed flying with Air France""", (Netherlands) ,17th September 2017,A320,Business,Economy Class,Paris to Nice,August 2017,5,5,4,0,5,0,5,yes
air france,1,"""have not received my lost baggage""", (Netherlands) ,17th September 2017,,Couple Leisure,Economy Class,Lyon to Rome,September 2017,3,3,3,0,1,0,1,
air france,10,"""I'd recommend Air France""", (Netherlands) ,15th September 2017,A380,Business,Premium Economy,Brussels to Johannesburg via Paris,September 2017,4,5,5,5,5,4,5,yes
air france,10,"""Very professional and attentive""", (Netherlands) ,13th September 2017,A319,Couple Leisure,Economy Class,Munich to Paris CDG,September 2017,3,5,5,0,5,0,5,yes
air france,1,"""there were many empty seats""", (Netherlands) ,7th September 2017,A330,Family Leisure,Economy Class,Paris CDG to Seattle,September 2017,3,5,3,3,1,0,1,
air france,3,"""old Business Class is a joke""", (Netherlands) ,30th August 2017,Boeing 777-300,Business,Business Class,Paris to Santiago de Chile,July 2017,2,1,3,3,3,0,2,
air france,6,"""luggage was not on the plane""", (Netherlands) ,30th August 2017,A380,Couple Leisure,Premium Economy,Paris to New York,August 2017,3,5,5,5,1,0,2,
air france,8,"""Ground staff service good""", (France) ,2nd November 2017,A319,Business,Economy Class,Paris Orly to Toulon,October 2017,3,4,2,0,4,0,2,yes
air france,8,"""good inflight service""", (France) ,2nd November 2017,Boeing 777-200,Business,Premium Economy,Cayenne to Paris Orly,October 2017,4,4,4,4,5,0,3,yes
air france,8,"""appreciated for size of seats""", (France) ,2nd November 2017,Boeing 777-200,Business,Premium Economy,Paris-Orly to Cayenne,October 2017,4,5,4,5,4,0,3,yes
air france,5,"""quantity of the food was below par""", (France) ,31st October 2017,Boeing 777-300 / A320,Solo Leisure,Economy Class,Amsterdam to Lima via Paris,October 2017,3,3,2,2,4,0,2,
air france,1,"""the worst customer experience2", (France) ,31st October 2017,A380,Business,Economy Class,Paris to San Francisco,October 2017,3,4,3,4,1,4,1,
air france,8,"""one of the best flights""", (France) ,27th October 2017,A380,Solo Leisure,Business Class,Paris CDG to New York,October 2017,3,5,3,2,2,0,5,yes
air france,2,"""A340 was old, smelly and dirty""", (France) ,21st October 2017,A340,Business,Economy Class,Bogota to Edinburgh via Paris CDG,October 2017,3,3,3,1,1,0,1,
air france,1,"""very bad customer service""", (France) ,19th October 2017,,Couple Leisure,Economy Class,Paris to Venice ,September 2017,1,1,0,0,1,0,1,
air france,10,"""cabin was looking new and clean""", (France) ,18th October 2017,Boeing 777-200ER,Solo Leisure,Economy Class,Paris CDG to Vancouver,October 2017,5,5,5,5,5,0,5,yes
air france,7,"""service was impeccable""", (France) ,16th October 2017,,Solo Leisure,Business Class,Dublin to Paris CDG,October 2017,3,5,3,0,2,0,3,yes
air france,1,"""ignore you wherever possible""", (India) ,8th October 2017,,Business,Economy Class,Bengaluru to Toronto via Paris,October 2017,2,1,1,0,1,0,1,
air france,10,"""attendants attentive and friendly""", (India) ,8th October 2017,Boeing 777-300ER,Solo Leisure,Economy Class,London to Bangkok via Paris,July 2017,4,5,4,5,5,0,5,yes
air france,5,"""Boarding was an absolute mess""", (India) ,4th October 2017,A321,Solo Leisure,Economy Class,Paris to Marseille,October 2017,3,5,2,0,1,0,3,yes
air france,3,"""my worst flight experience""", (India) ,3rd October 2017,,Family Leisure,Economy Class,Cairo to Amsterdam via Paris,September 2017,4,5,3,3,1,0,3,
air france,2,"""decision to no longer fly with them""", (India) ,3rd October 2017,,Solo Leisure,Economy Class,Point-a-Pitre to Marseille via Paris,November 2016,3,2,4,4,1,0,2,
air france,3,"""let down by ground staff""", (India) ,3rd October 2017,A320,Business,Economy Class,Paris to Nice,October 2017,2,3,1,0,1,0,1,
air france,1,"""everything I need is in my suitcase""", (India) ,2nd October 2017,Boeing 777-300,Solo Leisure,Economy Class,Amsterdam to Bangkok via Paris,October 2017,1,1,1,1,1,0,1,
air france,10,"""Great flights all round""", (India) ,1st October 2017,Boeing 787 / A318,Solo Leisure,Economy Class,London Heathrow to Paris,September 2017,5,5,5,5,5,5,5,yes
air france,1,"""my luggage never arrived""", (India) ,30th September 2017,,Couple Leisure,Economy Class,Paris CDG to London,September 2017,3,3,3,0,1,0,1,
air france,8,"""crew member was so helpful""", (India) ,29th September 2017,,Solo Leisure,Economy Class,Dublin to Paris,September 2017,3,5,3,0,1,0,4,yes
air france,10,"""friendly cabin crews""", (United Kingdom) ,28th August 2017,A319,Solo Leisure,Economy Class,London to Paris CDG,August 2017,5,4,4,0,5,0,5,yes
air france,7,"""convenient and reliable service""", (United Kingdom) ,26th August 2017,Embraer 170 / Avro RJ85,Solo Leisure,Economy Class,Paris to Bremen,August 2017,3,4,4,0,4,0,4,yes
air france,1,"""no one is capable of giving you an answer""", (United Kingdom) ,24th August 2017,Boeing 77,Couple Leisure,Economy Class,Dubai to Paris CDG,August 2017,3,3,0,0,1,0,1,
air france,5,"""seats are automatically assigned""", (United Kingdom) ,22nd August 2017,A321,Couple Leisure,Economy Class,Ajaccio to Paris Orly,August 2017,1,3,1,0,3,0,5,yes
air france,3,"""like going back in time""", (United Kingdom) ,22nd August 2017,,Business,Economy Class,Toronto to Frankfurt via Paris,August 2017,2,1,2,1,2,0,2,
air france,9,"""A very pleasant flight indeed""", (United Kingdom) ,20th August 2017,A318,Couple Leisure,Economy Class,Paris CDG to Figari ,August 2017,3,5,2,0,4,0,5,yes
air france,7,"""service friendly and personal""", (United Kingdom) ,19th August 2017,CRJ 1000 / A319,Solo Leisure,Economy Class,Amsterdam to Nantes,July 2017,4,3,3,0,2,0,3,yes
air france,9,"""definitely fly Air France again""", (United Kingdom) ,14th August 2017,Boeing 777-200,Solo Leisure,Business Class,Paris CDG to Sao Paulo,August 2017,4,5,5,4,4,0,4,yes
air france,1,"""Why won't someone help us""", (United Kingdom) ,8th August 2017,,Family Leisure,Economy Class,Manchester to Barcelona via Paris CDG,August 2017,0,0,0,0,0,0,1,
air france,9,"""definitely fly them again""", (United Kingdom) ,7th August 2017,Boeing 777-300,Business,First Class,Los Angeles to Barcelona via Paris,July 2017,5,5,4,5,4,0,5,yes
air france,1,"""never fly with them again""", (United States) ,16th May 2017,,Solo Leisure,Economy Class,Los Angeles to Amman via Paris,May 2017,1,1,1,2,1,0,1,
air france,9,"""service of a very high standard """, (United States) ,15th May 2017,Boeing 777-200ER,Couple Leisure,Business Class,Osaka to Paris,May 2017,5,5,5,5,4,0,2,yes
air france,2,"""Premium Economy disappointing.""", (United States) ,15th May 2017,Boeing 777-300ER,Couple Leisure,Premium Economy,Paris to Tokyo,April 2017,1,1,1,4,4,0,1,
air france,2,"""quality and comfort has decreased""", (United States) ,6th May 2017,Boeing 777-300,Family Leisure,Economy Class,Paris to Punta Cana,April 2017,1,3,2,1,3,0,2,
air france,3,"""service has critically decreased""", (United States) ,7th April 2017,Boeing 777-300,Couple Leisure,Economy Class,Singapore to Paris,April 2017,1,4,1,2,2,0,2,
air france,9,"""service was carried out efficiently""", (United States) ,2nd April 2017,A320,Business,Economy Class,Stockholm to Paris,April 2017,4,5,5,0,4,0,3,yes
air france,2,"""denied me my Elite status""", (United States) ,23rd March 2017,A320,Couple Leisure,Economy Class,Florence to St Petersburgh via Paris,March 2017,1,2,1,0,1,0,1,
air france,5,"""staff seemed to enjoy their work""", (United States) ,22nd March 2017,A320,Couple Leisure,Economy Class,Paris to Tel Aviv,March 2017,2,3,2,0,4,0,3,
air france,9,"""a very good choice""", (United States) ,19th March 2017,BAE 146-200,Solo Leisure,Economy Class,Paris CDG to Dusseldorf,March 2017,5,5,3,0,3,0,5,
air france,1,"""service was terrible""", (United States) ,17th March 2017,,Family Leisure,Economy Class,Warsaw to Paris,December 2016,2,1,1,0,1,0,1,
air france,4,"""poor quality of food""", (Canada) ,3rd August 2017,,Couple Leisure,Economy Class,Johannesburg to Paris,July 2017,3,1,1,3,3,0,3,
air france,8,"""Uneventful and convenient flight""", (Canada) ,28th July 2017,A318,Business,Economy Class,Florence to Paris CDG ,May 2017,4,4,3,0,4,0,5,yes
air france,3,"""no knowledge of nutrition""", (Canada) ,24th July 2017,Boeing 777,Business,Economy Class,Paris to Montreal,July 2017,2,1,1,3,4,0,2,
air france,7,"""seat is comfortable""", (Canada) ,22nd July 2017,ATR-72,Solo Leisure,Economy Class,Bordeaux to Florence via Lyons,June 2017,3,3,3,0,2,0,3,yes
air france,10,"""beautiful new cabin""", (Canada) ,20th July 2017,Boeing 787,Solo Leisure,Economy Class,London to Paris,June 2017,5,5,5,5,5,0,5,yes
air france,10,"""a pleasant flight""", (Canada) ,17th July 2017,A321,Solo Leisure,Economy Class,Paris to Rome,July 2017,4,5,4,0,5,0,4,yes
air france,9,"""best first class experience ever""", (Canada) ,13th July 2017,Boeing 777,Solo Leisure,First Class,Dublin to Singapore via Paris CDG,July 2017,5,5,4,5,4,4,4,yes
air france,9,"""staff very good and attentive""", (Canada) ,9th July 2017,Boeing 777-300,Business,Premium Economy,Dublin to Sao Paulo via Paris CDG,April 2017,3,4,4,4,4,0,4,yes
air france,8,"""definitely recommend Air France""", (Canada) ,7th July 2017,Boeing 777,Solo Leisure,Economy Class,Paris to Bangkok,June 2017,4,4,3,4,4,0,4,yes
air france,1,"""inconvenience for our family""", (Canada) ,6th July 2017,,Family Leisure,Economy Class,Florence to Paris,June 2017,1,1,0,0,1,0,1,
air france,8,"""provided a full meal""", (United States) ,16th June 2017,A320,Couple Leisure,Business Class,Paris CDG to Barcelona,June 2017,3,4,5,0,4,0,4,yes
air france,9,"""service was pleasant and professional""", (United States) ,16th June 2017,A380,Couple Leisure,Business Class,New York JFK to Paris CDG,June 2017,5,5,5,5,4,0,4,yes
air france,9,"""flight was excellent""", (United States) ,14th June 2017,Boeing 777-300ER,Couple Leisure,Premium Economy,Paris to Havana,June 2017,4,5,4,3,3,0,4,yes
air france,8,"""I recommend Air France""", (United States) ,14th June 2017,Boeing 777-300,Couple Leisure,Business Class,Sao Paulo to Paris,June 2017,4,4,4,3,4,0,4,yes
air france,9,"""definitely fly Air France again""", (United States) ,7th June 2017,E190 / Boeing 777-300ER,Solo Leisure,Economy Class,Dusseldorf to Miami via Paris,May 2017,5,5,5,4,5,0,5,yes
air france,3,"""Online check in wasn't possible""", (United States) ,3rd June 2017,,Couple Leisure,Economy Class,Lima to Paris,May 2017,1,1,3,1,4,0,3,
air france,10,"""exceeded our expectations""", (United States) ,2nd June 2017,Boeing 777-300ER,Couple Leisure,First Class,Singapore to Toulouse via Paris,June 2017,5,5,5,4,5,0,5,yes
air france,9,"""A380 is a great aircraft""", (United States) ,25th May 2017,A380,Couple Leisure,Economy Class,Newcastle to San Francisco via Paris,April 2017,4,4,5,3,4,0,4,yes
air france,8,"""Overall a nice experience""", (United States) ,23rd May 2017,A318,Couple Leisure,Economy Class,Copenhagen to Paris,May 2017,3,4,5,0,4,0,5,yes
air france,8,"""crew were friendly and attentive""", (United States) ,23rd May 2017,Boeing 777-300ER,Solo Leisure,Economy Class,Paris CDG to Atlanta,May 2017,3,4,4,4,4,0,4,yes
air france,8,"""A very good flight """, (United States) ,6th July 2017,,Solo Leisure,Economy Class,Paris CDG to Mumbai,January 2017,4,4,3,5,3,3,4,yes
air france,3,"""not without some trouble""", (United States) ,5th July 2017,,Family Leisure,Economy Class,Washington to Saint Petersburg via Paris,July 2017,4,3,3,4,1,0,2,
air france,7,"""Overall very satisfied""", (United States) ,4th July 2017,Boeing 777-200ER,Business,Economy Class,Paris to Dubai,July 2017,1,4,3,3,1,0,3,yes
air france,8,"""overall, two good flights""", (United States) ,3rd July 2017,Boeing 777-300 / A340,Solo Leisure,Economy Class,Tokyo to Freetown via Paris,July 2017,3,3,3,4,4,0,4,yes
air france,9,"""overall experience is satisfying""", (United States) ,1st July 2017,A319,Business,Economy Class,Sofia to Paris,June 2017,4,5,5,0,5,0,5,yes
air france,10,"""cabin crew took care of me""", (United States) ,27th June 2017,A320,Business,Economy Class,Prague to Paris CDG,May 2017,5,5,0,0,5,0,5,yes
air france,3,"""nowhere to be seen and barely doing their job""", (United States) ,22nd June 2017,Boeing 777-200,Family Leisure,Economy Class,Paris CDG to Cancun,June 2017,3,1,1,2,2,0,2,
air france,10,"""seats were comfortable""", (United States) ,20th June 2017,,Couple Leisure,Economy Class,Vancouver to Munich via Paris,June 2017,5,5,5,5,5,0,5,yes
air france,10,"""everything went above my expectations""", (United States) ,18th June 2017,Boeing 777-300,Solo Leisure,Economy Class,Hong Kong to Kiev via Paris CDG,May 2017,4,5,5,5,5,0,5,yes
air france,1,"""No info was briefed on why the delay""", (United States) ,18th June 2017,,Business,Economy Class,Cameroon to London Heathrow via Paris,June 2017,1,1,1,3,1,1,1,
air france,1,"""no greeting at the entrance""", (Germany) ,30th November 2016,Embraer RJ-170,Solo Leisure,Business Class,CDG to BRE,November 2016,1,1,1,0,1,0,1,
air france,3,"""very disappointing experience""", (Germany) ,24th November 2016,A380,Solo Leisure,Business Class,CDG to LAX,November 2016,3,2,1,1,4,0,3,
air france,9,"""I was not disappointed""", (Germany) ,22nd November 2016,A380,Solo Leisure,Economy Class,JFK to CDG,November 2016,4,5,5,5,4,0,4,yes
air france,7,"""flawless flight""", (Germany) ,21st November 2016,A319,Family Leisure,Economy Class,IST to CDG,November 2016,3,3,4,3,3,0,4,yes
air france,9,"""very pleasant flights""", (Germany) ,18th November 2016,A330-200,Couple Leisure,Economy Class,CDG to IAH,November 2016,4,5,4,4,5,0,5,yes
air france,7,"""nice entertainment system""", (Germany) ,15th November 2016,,Couple Leisure,Economy Class,CUN to CDG,November 2016,3,4,2,4,4,0,3,yes
air france,7,"""a solution of good value""", (Germany) ,13th November 2016,Boeing 777-300,Business,Premium Economy,YYZ to CDG,November 2016,3,1,1,0,2,0,4,yes
air france,1,"""transfer at Paris CDG horrible""", (Germany) ,8th November 2016,A340-300,Couple Leisure,Economy Class,SXM to VCE via CDG,November 2016,3,2,1,2,3,0,3,
air france,1,"""Air France managed to ruin it""", (Germany) ,6th November 2016,,Family Leisure,Economy Class,AMS to MRS,August 2016,3,3,4,0,1,0,1,
air france,4,"""with almost no service""", (Germany) ,3rd November 2016,Boeing 777-300ER,Couple Leisure,Economy Class,AMS to LIM via CDG,August 2016,3,1,2,4,5,0,4,
air france,10,"""I was most impressed""", (United Kingdom) ,15th January 2017,Boeing 777-200,Solo Leisure,Premium Economy,LHR to CPT via CDG,January 2017,3,4,3,0,5,0,4,yes
air france,8,"""upgrade to Premium Economy""", (United Kingdom) ,12th January 2017,Boeing 777,Couple Leisure,Premium Economy,PTY to FCO via CDG,October 2016,3,4,4,4,4,0,4,yes
air france,2,"""Air France needs a wake up call""", (United Kingdom) ,11th January 2017,A380,Business,First Class,HKG to CDG,December 2016,2,2,2,1,5,0,1,
air france,2,"""a truly regrettable service""", (United Kingdom) ,11th January 2017,,Couple Leisure,Economy Class,Madrid to Washington via Paris,January 2017,1,3,3,3,1,2,1,
